id,url,text,rating,time_created,user,restaurant_id
5t6Z1Ro6zM4-1M56W_xjxw,https://www.yelp.com/biz/pavelka-rio-de-janeiro?adjust_creative=ZaFQ4_OiriT3AVd55N_QPg&hrid=5t6Z1Ro6zM4-1M56W_xjxw&utm_campaign=yelp_api_v3&utm_medium=api_v3_business_reviews&utm_source=ZaFQ4_OiriT3AVd55N_QPg,We decided to try our lunch here today as they were participating in the Rio Burger Fest. They offered two types of burgers (Hambúrguer de linguiça...,2,2014-11-17 07:10:02,"{'id': '52R6YBCMU0yycOHKcnTXhA', 'profile_url': 'https://www.yelp.com/user_details?userid=52R6YBCMU0yycOHKcnTXhA', 'image_url': 'https://s3-media3.fl.yelpcdn.com/photo/EmOTGVlZxFTXNIykdZHDZg/o.jpg', 'name': 'Luciana Y.'}",jUxHXL_IRZJmnc8qDsm0sQ
ilYxu3zZ3YhS7XUf8DEvKw,https://www.yelp.com/biz/balada-mix-rio-de-janeiro-16?adjust_creative=ZaFQ4_OiriT3AVd55N_QPg&hrid=ilYxu3zZ3YhS7XUf8DEvKw&utm_campaign=yelp_api_v3&utm_medium=api_v3_business_reviews&utm_source=ZaFQ4_OiriT3AVd55N_QPg,"I freakin adore ballada mix. 

Everything I have got from here taste very good. Not all restaurants in Brazil serve simple but tasty food, but I think that...",5,2016-08-23 08:22:16,"{'id': 'HomfYCC-WpXCdpGbNH0tHg', 'profile_url': 'https://www.yelp.com/user_details?userid=HomfYCC-WpXCdpGbNH0tHg', 'image_url': 'https://s3-media3.fl.yelpcdn.com/photo/ecMTcEDjVwbsxf61wmRKew/o.jpg', 'name': 'Alona Vibe V.'}",d2tv_XQ-L4tRCeTsUvw81g
9x9aILm4Q3adtzod_umFRA,https://www.yelp.com/biz/balada-mix-rio-de-janeiro-16?adjust_creative=ZaFQ4_OiriT3AVd55N_QPg&hrid=9x9aILm4Q3adtzod_umFRA&utm_campaign=yelp_api_v3&utm_medium=api_v3_business_reviews&utm_source=ZaFQ4_OiriT3AVd55N_QPg,"If you want fresh juices,  salads, sandwiches,  burgers, Gluten free, meat,  chicken,  pizza.... They have it!!!  
You can build your plate (one grilled...",4,2015-09-13 16:03:13,"{'id': '52R6YBCMU0yycOHKcnTXhA', 'profile_url': 'https://www.yelp.com/user_details?userid=52R6YBCMU0yycOHKcnTXhA', 'image_url': 'https://s3-media3.fl.yelpcdn.com/photo/EmOTGVlZxFTXNIykdZHDZg/o.jpg', 'name': 'Luciana Y.'}",d2tv_XQ-L4tRCeTsUvw81g
8j9YFsqzuBP9sJ9cu54IdA,https://www.yelp.com/biz/balada-mix-rio-de-janeiro-16?adjust_creative=ZaFQ4_OiriT3AVd55N_QPg&hrid=8j9YFsqzuBP9sJ9cu54IdA&utm_campaign=yelp_api_v3&utm_medium=api_v3_business_reviews&utm_source=ZaFQ4_OiriT3AVd55N_QPg,Nice place for dinner but even nicer for lunch. Nice street with bars and restaurants. Food is expensive for what it is but the place feels carioca. I...,4,2015-11-16 14:24:36,"{'id': 'MYbxR-oW8RUp_FGsNEi0Ow', 'profile_url': 'https://www.yelp.com/user_details?userid=MYbxR-oW8RUp_FGsNEi0Ow', 'image_url': 'https://s3-media3.fl.yelpcdn.com/photo/tTzsPUlcH9k5ONWeZxwA4g/o.jpg', 'name': 'Gabriela R.'}",d2tv_XQ-L4tRCeTsUvw81g
v_AN0_nAO0A811AosVkcJA,https://www.yelp.com/biz/improviso-rio-de-janeiro?adjust_creative=ZaFQ4_OiriT3AVd55N_QPg&hrid=v_AN0_nAO0A811AosVkcJA&utm_campaign=yelp_api_v3&utm_medium=api_v3_business_reviews&utm_source=ZaFQ4_OiriT3AVd55N_QPg,I had a great time here!  It's in the Arco de Lapa area.  We were strongly advised to take a taxi - and  not take the metro and walk from the station - for...,4,2017-03-26 12:12:54,"{'id': 'e3Q_YeEZz2vzxkZBauX8-w', 'profile_url': 'https://www.yelp.com/user_details?userid=e3Q_YeEZz2vzxkZBauX8-w', 'image_url': 'https://s3-media2.fl.yelpcdn.com/photo/RaDpiihL2RUKxEh8l3vYQQ/o.jpg', 'name': 'Nina R.'}",WAci6T9EzEVYDHEj3OSNYw
0uQk_gyKF-gVJyk94OSyhw,https://www.yelp.com/biz/churrascaria-carret%C3%A3o-rio-de-janeiro-3?adjust_creative=ZaFQ4_OiriT3AVd55N_QPg&hrid=0uQk_gyKF-gVJyk94OSyhw&utm_campaign=yelp_api_v3&utm_medium=api_v3_business_reviews&utm_source=ZaFQ4_OiriT3AVd55N_QPg,"Here in Rio de Janeiro and what better thing to do than to visit a true Brazilian steakhouse. I've been to one back home, but I wasn't that impressed since...",4,2020-02-25 02:46:30,"{'id': 'NMGlN9NsxTLuY239UAJiHg', 'profile_url': 'https://www.yelp.com/user_details?userid=NMGlN9NsxTLuY239UAJiHg', 'image_url': 'https://s3-media4.fl.yelpcdn.com/photo/o4YGkAyIgImD0Lrkuig2KQ/o.jpg', 'name': 'Chuck M.'}",pfdnBMVVdIYzr0UibFJIFQ
tZnJZQQU7imxl-HWfOMBcw,https://www.yelp.com/biz/churrascaria-carret%C3%A3o-rio-de-janeiro-3?adjust_creative=ZaFQ4_OiriT3AVd55N_QPg&hrid=tZnJZQQU7imxl-HWfOMBcw&utm_campaign=yelp_api_v3&utm_medium=api_v3_business_reviews&utm_source=ZaFQ4_OiriT3AVd55N_QPg,"I came in a little weary, this lunch was included in our group tour of the Brazilian sites we bought with TripAdvisor, but I was really pleasantly...",4,2019-04-12 21:32:54,"{'id': 'sgSy3pBULfKuVLgHzitwQg', 'profile_url': 'https://www.yelp.com/user_details?userid=sgSy3pBULfKuVLgHzitwQg', 'image_url': 'https://s3-media1.fl.yelpcdn.com/photo/f1BUx_m0FBdZz8gHC-__rQ/o.jpg', 'name': 'Tash B.'}",pfdnBMVVdIYzr0UibFJIFQ
_b0O3qqI3Ifo7uJ87cEn7g,https://www.yelp.com/biz/churrascaria-carret%C3%A3o-rio-de-janeiro-3?adjust_creative=ZaFQ4_OiriT3AVd55N_QPg&hrid=_b0O3qqI3Ifo7uJ87cEn7g&utm_campaign=yelp_api_v3&utm_medium=api_v3_business_reviews&utm_source=ZaFQ4_OiriT3AVd55N_QPg,"I was really looking forward to having some churrasco and other meats in Brazil, thinking about a Brazilian steakhouse.  Unfortunately the meats were...",3,2020-07-25 18:52:21,"{'id': 'eSlOI3GhroEtcbaD_nFXJQ', 'profile_url': 'https://www.yelp.com/user_details?userid=eSlOI3GhroEtcbaD_nFXJQ', 'image_url': 'https://s3-media3.fl.yelpcdn.com/photo/4NdVGPqff50cNEcX7CmHDQ/o.jpg', 'name': 'Jason G.'}",pfdnBMVVdIYzr0UibFJIFQ
pAhNu5UrYnArO4ZdAEVdkw,https://www.yelp.com/biz/arp%C3%B4-restobar-rio-de-janeiro-2?adjust_creative=ZaFQ4_OiriT3AVd55N_QPg&hrid=pAhNu5UrYnArO4ZdAEVdkw&utm_campaign=yelp_api_v3&utm_medium=api_v3_business_reviews&utm_source=ZaFQ4_OiriT3AVd55N_QPg,"Fantastic little Brazilian buffet with a nice owner that speaks Portuguese, Spanish, and a little English.

We went for lunch and found a reasonable pricing...",4,2015-08-10 09:57:18,"{'id': 'taHBmut0Qx8z90UgF93xoA', 'profile_url': 'https://www.yelp.com/user_details?userid=taHBmut0Qx8z90UgF93xoA', 'image_url': 'https://s3-media4.fl.yelpcdn.com/photo/ooklKLwHoviBvJQrbdFHOg/o.jpg', 'name': 'Ming L.'}",0bEV89kjqqueipYLixaIyQ
vhTfFtjrYLQ-VxpBKBhd0w,https://www.yelp.com/biz/confeitaria-colombo-rio-de-janeiro-3?adjust_creative=ZaFQ4_OiriT3AVd55N_QPg&hrid=vhTfFtjrYLQ-VxpBKBhd0w&utm_campaign=yelp_api_v3&utm_medium=api_v3_business_reviews&utm_source=ZaFQ4_OiriT3AVd55N_QPg,"Gorgeous view, cute cafe, delicious sweets! Got the brigadeiro and had to come back another day to get even more brigadeiro since I didn't realize how...",4,2020-03-24 18:00:16,"{'id': 'YgTleYno1TQjVr3aCBPgvw', 'profile_url': 'https://www.yelp.com/user_details?userid=YgTleYno1TQjVr3aCBPgvw', 'image_url': 'https://s3-media4.fl.yelpcdn.com/photo/1SDOxJrgzsN5QCcq_d0TMg/o.jpg', 'name': 'Anna L.'}",fWN7IvjEDsXxaMocjmvCaA
5eYshqCwgQxcyi7YOEze_A,https://www.yelp.com/biz/confeitaria-colombo-rio-de-janeiro-3?adjust_creative=ZaFQ4_OiriT3AVd55N_QPg&hrid=5eYshqCwgQxcyi7YOEze_A&utm_campaign=yelp_api_v3&utm_medium=api_v3_business_reviews&utm_source=ZaFQ4_OiriT3AVd55N_QPg,Food was really good! I was impressed. Great views and excellent customer service. There is a checkin to reserve a table online. Only negative is I waited...,4,2021-11-28 13:46:53,"{'id': 'hRJ_TzSCv_UnSigD9jn0bw', 'profile_url': 'https://www.yelp.com/user_details?userid=hRJ_TzSCv_UnSigD9jn0bw', 'image_url': 'https://s3-media4.fl.yelpcdn.com/photo/l3tH-zIb-nEDCxk3BFmbuQ/o.jpg', 'name': 'Emmanuel I.'}",fWN7IvjEDsXxaMocjmvCaA
lqZ1CAdMYwZ_cm98D4PHtw,https://www.yelp.com/biz/confeitaria-colombo-rio-de-janeiro-3?adjust_creative=ZaFQ4_OiriT3AVd55N_QPg&hrid=lqZ1CAdMYwZ_cm98D4PHtw&utm_campaign=yelp_api_v3&utm_medium=api_v3_business_reviews&utm_source=ZaFQ4_OiriT3AVd55N_QPg,Poor imitation of the original. Food that should have been hot was cold (we were told that it was made to order). Bread was stale. Go to the original one if...,2,2019-09-15 09:53:42,"{'id': 'JsIFqXo9wnGIeGYKKyKYXg', 'profile_url': 'https://www.yelp.com/user_details?userid=JsIFqXo9wnGIeGYKKyKYXg', 'image_url': 'https://s3-media2.fl.yelpcdn.com/photo/VPiO-6UJaEnHCyPPicijfw/o.jpg', 'name': 'Carmen H.'}",fWN7IvjEDsXxaMocjmvCaA
WGSTo7C1txHiw0SNLaBqgQ,https://www.yelp.com/biz/r%C3%A1scal-rio-de-janeiro?adjust_creative=ZaFQ4_OiriT3AVd55N_QPg&hrid=WGSTo7C1txHiw0SNLaBqgQ&utm_campaign=yelp_api_v3&utm_medium=api_v3_business_reviews&utm_source=ZaFQ4_OiriT3AVd55N_QPg,"O melhor restaurante no Shopping Leblon, por um preço ótimo! O buffet 'e delicioso, com muitas opções saudáveis. Excelente seleção de bebidas...",5,2015-03-02 20:06:50,"{'id': 'Meie-5Xm92AmC7iYoosBww', 'profile_url': 'https://www.yelp.com/user_details?userid=Meie-5Xm92AmC7iYoosBww', 'image_url': 'https://s3-media4.fl.yelpcdn.com/photo/A18kfYmvLJMI8HWuWj41YA/o.jpg', 'name': 'manoela w.'}",kBGTB54PAMHhEqq_0zSDsg
eGNr5nVo8YOQAvbOehKWCQ,https://www.yelp.com/biz/cl%C3%A1ssico-beach-club-urca-rio-de-janeiro?adjust_creative=ZaFQ4_OiriT3AVd55N_QPg&hrid=eGNr5nVo8YOQAvbOehKWCQ&utm_campaign=yelp_api_v3&utm_medium=api_v3_business_reviews&utm_source=ZaFQ4_OiriT3AVd55N_QPg,"Experience: After exploring the different sections of Sugarloaf, we decided to have lunch with a view. There are many different cafes and restaurants to...",5,2023-11-09 19:22:13,"{'id': 'IWVLQkycvtbPnIPE0nongQ', 'profile_url': 'https://www.yelp.com/user_details?userid=IWVLQkycvtbPnIPE0nongQ', 'image_url': 'https://s3-media2.fl.yelpcdn.com/photo/KYCgqTWwD9Q5QhMn25J62g/o.jpg', 'name': 'Lyna K.'}",HcqPADOJuech5Lka1ck0tQ
9OQcDfLu9PPM0KnXZ9YWVg,https://www.yelp.com/biz/cl%C3%A1ssico-beach-club-urca-rio-de-janeiro?adjust_creative=ZaFQ4_OiriT3AVd55N_QPg&hrid=9OQcDfLu9PPM0KnXZ9YWVg&utm_campaign=yelp_api_v3&utm_medium=api_v3_business_reviews&utm_source=ZaFQ4_OiriT3AVd55N_QPg,Great views from the up top. Your mostly enjoying the great view. I would suggest to go early to visit while the sun is out. As you progress into the day it...,4,2023-03-14 07:47:58,"{'id': 'H_MCU7uyCGjxHONcn20gzw', 'profile_url': 'https://www.yelp.com/user_details?userid=H_MCU7uyCGjxHONcn20gzw', 'image_url': 'https://s3-media3.fl.yelpcdn.com/photo/7AXd9ZO5oL7egmXHUMV3Ew/o.jpg', 'name': 'Raymond C.'}",HcqPADOJuech5Lka1ck0tQ
uveJBU7ss2cnVBAG_qmSVQ,https://www.yelp.com/biz/cl%C3%A1ssico-beach-club-urca-rio-de-janeiro?adjust_creative=ZaFQ4_OiriT3AVd55N_QPg&hrid=uveJBU7ss2cnVBAG_qmSVQ&utm_campaign=yelp_api_v3&utm_medium=api_v3_business_reviews&utm_source=ZaFQ4_OiriT3AVd55N_QPg,Beautiful view beautiful service. They mostly serve seafood and cheese dishes. The Capannina the light but delicious,5,2022-04-21 10:31:22,"{'id': 'dd0EieV5gdf6YfUDg43oKw', 'profile_url': 'https://www.yelp.com/user_details?userid=dd0EieV5gdf6YfUDg43oKw', 'image_url': 'https://s3-media1.fl.yelpcdn.com/photo/Ah0w31i44VhXkCbm4Dti1w/o.jpg', 'name': 'Lisa S.'}",HcqPADOJuech5Lka1ck0tQ
_aC0GoNogmDau7fsJSTJ4Q,https://www.yelp.com/biz/nori-cozinha-oriental-rio-de-janeiro?adjust_creative=ZaFQ4_OiriT3AVd55N_QPg&hrid=_aC0GoNogmDau7fsJSTJ4Q&utm_campaign=yelp_api_v3&utm_medium=api_v3_business_reviews&utm_source=ZaFQ4_OiriT3AVd55N_QPg,"Looking for great quality sushi in lower Leblon (closer to Ipanema)? Nori was a find within the chic Shopping Leblon mall. Located on the uppermost floor,...",4,2015-10-06 16:38:38,"{'id': 'RgDVC3ZUBqpEe6Y1kPhIpw', 'profile_url': 'https://www.yelp.com/user_details?userid=RgDVC3ZUBqpEe6Y1kPhIpw', 'image_url': 'https://s3-media4.fl.yelpcdn.com/photo/MPIOsWVjVXE7_VilIzXJiQ/o.jpg', 'name': 'Monica S.'}",oTEZi5IH339Yhp4WQcio1Q
UNuCELEUfvxYY6dskmkROg,https://www.yelp.com/biz/japa-b-rio-de-janeiro?adjust_creative=ZaFQ4_OiriT3AVd55N_QPg&hrid=UNuCELEUfvxYY6dskmkROg&utm_campaign=yelp_api_v3&utm_medium=api_v3_business_reviews&utm_source=ZaFQ4_OiriT3AVd55N_QPg,"My friend recommended me this place so I had good expectations. I went on  a Wednesday and surprisingly it was really crowded. 
The hostess was not...",3,2016-03-16 12:06:42,"{'id': '9mCy_X02FWv9drfap1coYg', 'profile_url': 'https://www.yelp.com/user_details?userid=9mCy_X02FWv9drfap1coYg', 'image_url': 'https://s3-media2.fl.yelpcdn.com/photo/JIfcgg32JqtWxG75InT-iw/o.jpg', 'name': 'Larissa G.'}",xopYrLm6Gfm2LBeS_t93Xg
cPWAmaLJLwzLTx_wxoztdg,https://www.yelp.com/biz/lapamaki-ipanema-rio-de-janeiro?adjust_creative=ZaFQ4_OiriT3AVd55N_QPg&hrid=cPWAmaLJLwzLTx_wxoztdg&utm_campaign=yelp_api_v3&utm_medium=api_v3_business_reviews&utm_source=ZaFQ4_OiriT3AVd55N_QPg,"We loved it here so much. A charming little gem, we liked it better than Manekineko. The food was some of the best sushi we have ever had. The service was...",5,2020-02-03 06:15:55,"{'id': '1EzIbLX2ZGvF1assz8x9TA', 'profile_url': 'https://www.yelp.com/user_details?userid=1EzIbLX2ZGvF1assz8x9TA', 'image_url': 'https://s3-media3.fl.yelpcdn.com/photo/rjavtvw9_FLNubKX94QtSA/o.jpg', 'name': 'Kayla F.'}",a7BOpvI1zbJy1WZbexaLNg
U-hTYU9Fvb23vAUlVE_44w,https://www.yelp.com/biz/lapamaki-ipanema-rio-de-janeiro?adjust_creative=ZaFQ4_OiriT3AVd55N_QPg&hrid=U-hTYU9Fvb23vAUlVE_44w&utm_campaign=yelp_api_v3&utm_medium=api_v3_business_reviews&utm_source=ZaFQ4_OiriT3AVd55N_QPg,"My family and I had the best experience here tonight! We received free appetizers on the house, and the sushi was so delicious. Wasn't sure what to expect...",5,2018-06-29 16:26:51,"{'id': 'McRl2dlDU8gVhVu_Oc-Z7Q', 'profile_url': 'https://www.yelp.com/user_details?userid=McRl2dlDU8gVhVu_Oc-Z7Q', 'image_url': 'https://s3-media2.fl.yelpcdn.com/photo/SEqqzpKzvRSxS6J3TuKhvA/o.jpg', 'name': 'Taylor S.'}",a7BOpvI1zbJy1WZbexaLNg
VvK3DYn8ewS_fG5n7CKvCw,https://www.yelp.com/biz/lapamaki-ipanema-rio-de-janeiro?adjust_creative=ZaFQ4_OiriT3AVd55N_QPg&hrid=VvK3DYn8ewS_fG5n7CKvCw&utm_campaign=yelp_api_v3&utm_medium=api_v3_business_reviews&utm_source=ZaFQ4_OiriT3AVd55N_QPg,"Ooh yeah great spot.  Smallish cuts of fish but the prices are low, so it's a good value.  Pic is of 40R$/$10US for a nice combo sushi/nigiri.  Leaving this...",5,2018-10-03 17:47:33,"{'id': 'JGGSxfGyUv3rvYpwtKy9Yw', 'profile_url': 'https://www.yelp.com/user_details?userid=JGGSxfGyUv3rvYpwtKy9Yw', 'image_url': 'https://s3-media1.fl.yelpcdn.com/photo/AqSzVNvt6mC25Aa-VNECjg/o.jpg', 'name': 'G M.'}",a7BOpvI1zbJy1WZbexaLNg
48d2ym6BYYBJKx24uWNjiQ,https://www.yelp.com/biz/angu-do-gomes-rio-de-janeiro?adjust_creative=ZaFQ4_OiriT3AVd55N_QPg&hrid=48d2ym6BYYBJKx24uWNjiQ&utm_campaign=yelp_api_v3&utm_medium=api_v3_business_reviews&utm_source=ZaFQ4_OiriT3AVd55N_QPg,Pedra do Sal is an interesting open air area that was once a slave market but has since been transformed into a street party every Monday night. Angu do...,4,2015-06-22 17:16:53,"{'id': 'h3WYXA8nX5EV55u-P3y7Ew', 'profile_url': 'https://www.yelp.com/user_details?userid=h3WYXA8nX5EV55u-P3y7Ew', 'image_url': 'https://s3-media4.fl.yelpcdn.com/photo/IFxmd-TPsfGq48Bb-8uI3w/o.jpg', 'name': 'Charles L.'}",FHvx-NeDSNZ9BFimLzoIUg
kNFB9BuiLBccorUaLgI4pA,https://www.yelp.com/biz/paris-6-rio-de-janeiro?adjust_creative=ZaFQ4_OiriT3AVd55N_QPg&hrid=kNFB9BuiLBccorUaLgI4pA&utm_campaign=yelp_api_v3&utm_medium=api_v3_business_reviews&utm_source=ZaFQ4_OiriT3AVd55N_QPg,"Nice scenario and decoration. Open 24h as I heard. The desserts are awesome. The food is ok, no complains. Would comeback just for dessert ....",4,2022-07-18 13:41:23,"{'id': 'zGRNveEsuO6qE-rNQcOg1g', 'profile_url': 'https://www.yelp.com/user_details?userid=zGRNveEsuO6qE-rNQcOg1g', 'image_url': None, 'name': 'Ricardo M.'}",wBQBlJgWwZtBF992CctGkQ
GfPLHA2i2qyYPBhY3mXzjg,https://www.yelp.com/biz/paris-6-rio-de-janeiro?adjust_creative=ZaFQ4_OiriT3AVd55N_QPg&hrid=GfPLHA2i2qyYPBhY3mXzjg&utm_campaign=yelp_api_v3&utm_medium=api_v3_business_reviews&utm_source=ZaFQ4_OiriT3AVd55N_QPg,If you are looking for tasty food Paris 6 is definitely not the place to go. The food here is blend. We ordered a Salmon Tartare for an appetizer which...,3,2014-08-17 06:05:21,"{'id': 'TRuXAggLKgNCzbJQGw0zSA', 'profile_url': 'https://www.yelp.com/user_details?userid=TRuXAggLKgNCzbJQGw0zSA', 'image_url': None, 'name': 'George M.'}",wBQBlJgWwZtBF992CctGkQ
q-AXbdCWaUIRcRcdHR1-Dg,https://www.yelp.com/biz/casa-graviola-rio-de-janeiro?adjust_creative=ZaFQ4_OiriT3AVd55N_QPg&hrid=q-AXbdCWaUIRcRcdHR1-Dg&utm_campaign=yelp_api_v3&utm_medium=api_v3_business_reviews&utm_source=ZaFQ4_OiriT3AVd55N_QPg,"Healthy, fresh, creative, picturesque! Loved this place. A lot of millennial and Gen Z vibes. I had the grilled veggie platter with a side of tuna - it was...",5,2020-12-16 13:04:53,"{'id': 'DTKuc_AfULkcXXkcFraYiw', 'profile_url': 'https://www.yelp.com/user_details?userid=DTKuc_AfULkcXXkcFraYiw', 'image_url': 'https://s3-media3.fl.yelpcdn.com/photo/JonHuJ2Ai0WZHiQLV2Cgxw/o.jpg', 'name': 'Peixin M.'}",hSCqZbbZCTJ6oEtCCjVYPg
ydwpmqGa0CIHV43KpVEhBg,https://www.yelp.com/biz/casa-graviola-rio-de-janeiro?adjust_creative=ZaFQ4_OiriT3AVd55N_QPg&hrid=ydwpmqGa0CIHV43KpVEhBg&utm_campaign=yelp_api_v3&utm_medium=api_v3_business_reviews&utm_source=ZaFQ4_OiriT3AVd55N_QPg,"Organic, natural, healthy Brazilian food in a hip, eco-conscious, and relaxed setting. Friendly vibe too and the staff enjoys speaking English :)

They have...",5,2018-07-29 08:47:57,"{'id': 'uIjj7EIVBU4kGNgmKPO02A', 'profile_url': 'https://www.yelp.com/user_details?userid=uIjj7EIVBU4kGNgmKPO02A', 'image_url': 'https://s3-media1.fl.yelpcdn.com/photo/mtTegMsecgFo2R_qqrZaRA/o.jpg', 'name': 'Israel G.'}",hSCqZbbZCTJ6oEtCCjVYPg
wEgvdWF4EOvc-OqiQrV0vg,https://www.yelp.com/biz/casa-graviola-rio-de-janeiro?adjust_creative=ZaFQ4_OiriT3AVd55N_QPg&hrid=wEgvdWF4EOvc-OqiQrV0vg&utm_campaign=yelp_api_v3&utm_medium=api_v3_business_reviews&utm_source=ZaFQ4_OiriT3AVd55N_QPg,"Graviola is a very charming restaurant located in the heart of Leblon. With an extensive menu of healthy/natural food and amazing juices (and açaí), this is...",4,2018-12-17 18:43:54,"{'id': 'kF60WLpDwS_ZPRZwB-5_xA', 'profile_url': 'https://www.yelp.com/user_details?userid=kF60WLpDwS_ZPRZwB-5_xA', 'image_url': 'https://s3-media4.fl.yelpcdn.com/photo/aRoY-MmdWkzctYS5kIk6xg/o.jpg', 'name': 'David N.'}",hSCqZbbZCTJ6oEtCCjVYPg
R_Mza2Xog6mKaD35-8PjjQ,https://www.yelp.com/biz/faenza-rio-de-janeiro-2?adjust_creative=ZaFQ4_OiriT3AVd55N_QPg&hrid=R_Mza2Xog6mKaD35-8PjjQ&utm_campaign=yelp_api_v3&utm_medium=api_v3_business_reviews&utm_source=ZaFQ4_OiriT3AVd55N_QPg,"Delicious steak with gorgonzola cheese. Yummy pasta, and amazing bruschetta. If you order a suco (juice) here, make sure to ask that it has sugar, otherwise...",4,2020-01-05 16:16:59,"{'id': 'BD6Fi7OhyayGEkHPmG3Qlw', 'profile_url': 'https://www.yelp.com/user_details?userid=BD6Fi7OhyayGEkHPmG3Qlw', 'image_url': None, 'name': 'Ashley A.'}",kPHU2lK4TDCMa1IVAKGHFw
rhoL9I5fzXIawjh32WyXxg,https://www.yelp.com/biz/faenza-rio-de-janeiro-2?adjust_creative=ZaFQ4_OiriT3AVd55N_QPg&hrid=rhoL9I5fzXIawjh32WyXxg&utm_campaign=yelp_api_v3&utm_medium=api_v3_business_reviews&utm_source=ZaFQ4_OiriT3AVd55N_QPg,How do I start....Pizza is mediocre at best. Slow service as they are both trying to do a delivery service as well as rodízio at the same time...the food is...,2,2017-10-29 15:10:04,"{'id': 'pRdTBODqwkRx2X2TG2-WrQ', 'profile_url': 'https://www.yelp.com/user_details?userid=pRdTBODqwkRx2X2TG2-WrQ', 'image_url': 'https://s3-media4.fl.yelpcdn.com/photo/ItAkW967Ymy8Y_PvmRpV8A/o.jpg', 'name': 'Michael C.'}",kPHU2lK4TDCMa1IVAKGHFw
6Cn3iKvZRpqH82pwKPXrUA,https://www.yelp.com/biz/faenza-rio-de-janeiro-2?adjust_creative=ZaFQ4_OiriT3AVd55N_QPg&hrid=6Cn3iKvZRpqH82pwKPXrUA&utm_campaign=yelp_api_v3&utm_medium=api_v3_business_reviews&utm_source=ZaFQ4_OiriT3AVd55N_QPg,"Pizza is good. Ambiance is good. Very good service, staff is great. Drinks are good. Not sure if prices are good since the drinks impaired my ability to...",4,2014-07-16 16:32:59,"{'id': 'wCdVmMq591PJFIC0ordtXQ', 'profile_url': 'https://www.yelp.com/user_details?userid=wCdVmMq591PJFIC0ordtXQ', 'image_url': 'https://s3-media2.fl.yelpcdn.com/photo/Ea9POzCHlfjsY6yzAUNO7w/o.jpg', 'name': 'Dale A.'}",kPHU2lK4TDCMa1IVAKGHFw
TbDUnBIaIiv16r6B16T09w,https://www.yelp.com/biz/garota-rio-de-janeiro?adjust_creative=ZaFQ4_OiriT3AVd55N_QPg&hrid=TbDUnBIaIiv16r6B16T09w&utm_campaign=yelp_api_v3&utm_medium=api_v3_business_reviews&utm_source=ZaFQ4_OiriT3AVd55N_QPg,"Yummy yummy in my tummy. This place is very close to my school in Urca so I often come here for lunch. For lunch, they have daily specials for very cheap. I...",5,2015-07-29 09:04:16,"{'id': 'WqI0F3rRYTiH_XlxxOlDvQ', 'profile_url': 'https://www.yelp.com/user_details?userid=WqI0F3rRYTiH_XlxxOlDvQ', 'image_url': 'https://s3-media4.fl.yelpcdn.com/photo/7i0-HE1cvpaTW1YqJQlHCA/o.jpg', 'name': 'Avery K.'}",scL0RzNDi0oP7GIOS0GnJw
VvuqcfkfE59Gvcd-yeXoDw,https://www.yelp.com/biz/garota-rio-de-janeiro?adjust_creative=ZaFQ4_OiriT3AVd55N_QPg&hrid=VvuqcfkfE59Gvcd-yeXoDw&utm_campaign=yelp_api_v3&utm_medium=api_v3_business_reviews&utm_source=ZaFQ4_OiriT3AVd55N_QPg,"Splendid !
Steogonofi was splendid- chicken , rice , mushrooms and creamy soft curry like sauce on top with baked potato slices.
Caipirinhas are small but...",4,2018-11-07 16:09:07,"{'id': 'uiSM831U4Ly0xkLl2pLDVw', 'profile_url': 'https://www.yelp.com/user_details?userid=uiSM831U4Ly0xkLl2pLDVw', 'image_url': 'https://s3-media3.fl.yelpcdn.com/photo/z3d8xYsn0PrQxZUIUExAcg/o.jpg', 'name': 'Francisco L.'}",scL0RzNDi0oP7GIOS0GnJw
pXUND_Fj-KsKMolGWTHriA,https://www.yelp.com/biz/garota-rio-de-janeiro?adjust_creative=ZaFQ4_OiriT3AVd55N_QPg&hrid=pXUND_Fj-KsKMolGWTHriA&utm_campaign=yelp_api_v3&utm_medium=api_v3_business_reviews&utm_source=ZaFQ4_OiriT3AVd55N_QPg,"This is my favorite restaurant in Rio! The picanha was perfect, especially because we finish cooking it at the table, which is perfect for sharing. Oh and...",5,2016-02-12 10:15:14,"{'id': 'ZOmlXwK7pWGjzQGIBhB5qA', 'profile_url': 'https://www.yelp.com/user_details?userid=ZOmlXwK7pWGjzQGIBhB5qA', 'image_url': 'https://s3-media2.fl.yelpcdn.com/photo/Dkv5MGTtcMAhRL56aqSusA/o.jpg', 'name': 'Marquisha L.'}",scL0RzNDi0oP7GIOS0GnJw
Pz5ryc-HM-pZX8RCVFCufw,https://www.yelp.com/biz/bar-trope%C3%A7o-rio-de-janeiro?adjust_creative=ZaFQ4_OiriT3AVd55N_QPg&hrid=Pz5ryc-HM-pZX8RCVFCufw&utm_campaign=yelp_api_v3&utm_medium=api_v3_business_reviews&utm_source=ZaFQ4_OiriT3AVd55N_QPg,"Nice place.  Average price is around 28 reales for a salmon plate with fries and rice.  
We also had the chicken plate that was around the same price....",4,2015-07-08 13:03:56,"{'id': 'WHTINUrvURr1dyzvHSyyGw', 'profile_url': 'https://www.yelp.com/user_details?userid=WHTINUrvURr1dyzvHSyyGw', 'image_url': 'https://s3-media2.fl.yelpcdn.com/photo/_3I5swfIUdVamaafyhRR3Q/o.jpg', 'name': 'Sergio G.'}",7kzvkvZnKBCvWXwDAIn-Jw
RIur2KwadQNKq22JlGtaCQ,https://www.yelp.com/biz/bar-trope%C3%A7o-rio-de-janeiro?adjust_creative=ZaFQ4_OiriT3AVd55N_QPg&hrid=RIur2KwadQNKq22JlGtaCQ&utm_campaign=yelp_api_v3&utm_medium=api_v3_business_reviews&utm_source=ZaFQ4_OiriT3AVd55N_QPg,"Degrau is a very old restaurant in town, and a very traditional place in leblon. The food and the service are good.",4,2014-08-04 14:42:25,"{'id': 'kLtoDgHQXAvfwTbbc3OIdg', 'profile_url': 'https://www.yelp.com/user_details?userid=kLtoDgHQXAvfwTbbc3OIdg', 'image_url': 'https://s3-media1.fl.yelpcdn.com/photo/WO5GPaaQeOtYH35zXclo9w/o.jpg', 'name': 'Isabel S.'}",7kzvkvZnKBCvWXwDAIn-Jw
pan3CE7JU5kRuYC3FpKqXw,https://www.yelp.com/biz/habibs-quiosque-rio-de-janeiro?adjust_creative=ZaFQ4_OiriT3AVd55N_QPg&hrid=pan3CE7JU5kRuYC3FpKqXw&utm_campaign=yelp_api_v3&utm_medium=api_v3_business_reviews&utm_source=ZaFQ4_OiriT3AVd55N_QPg,"So I would call these mini pizzas but shhh don't tell a Brazilian that! 

This location is right on the copacabana beach area and it's outdoor seating....",4,2020-04-22 00:24:42,"{'id': 'c_YjHxlnDARw6UothG05sg', 'profile_url': 'https://www.yelp.com/user_details?userid=c_YjHxlnDARw6UothG05sg', 'image_url': 'https://s3-media1.fl.yelpcdn.com/photo/riWzgrbzYJEbDiKpRJejvQ/o.jpg', 'name': 'Kandis J.'}",E05BBj-2k1cn-FGUngwG0Q
AFolIKQ3zQT-kdngTfzgmg,https://www.yelp.com/biz/restaurante-siri-rio-de-janeiro-8?adjust_creative=ZaFQ4_OiriT3AVd55N_QPg&hrid=AFolIKQ3zQT-kdngTfzgmg&utm_campaign=yelp_api_v3&utm_medium=api_v3_business_reviews&utm_source=ZaFQ4_OiriT3AVd55N_QPg,If you're wanting to taste some amazing fish in Brazil then you have got to come here! I've had two meals here and both were great. We ordered enpanado with...,5,2017-07-15 17:57:26,"{'id': '8A5XHVGSlFIOOC1WgbaVMg', 'profile_url': 'https://www.yelp.com/user_details?userid=8A5XHVGSlFIOOC1WgbaVMg', 'image_url': 'https://s3-media3.fl.yelpcdn.com/photo/-27BPS0jNQNtnz7Tb2RgHg/o.jpg', 'name': 'rebekah s.'}",qM78oDSyhwZN1XCVX3yvlQ
PKaZlRGd-tupIN5jQK_qtg,https://www.yelp.com/biz/madero-rio-de-janeiro?adjust_creative=ZaFQ4_OiriT3AVd55N_QPg&hrid=PKaZlRGd-tupIN5jQK_qtg&utm_campaign=yelp_api_v3&utm_medium=api_v3_business_reviews&utm_source=ZaFQ4_OiriT3AVd55N_QPg,Great option if you're shopping and need a good bite to eat. The place was packed but we were able to grab a table. They had tvs and it was a bit loud but...,4,2023-04-28 15:32:28,"{'id': '9jDC8hjrEqYGm4Ju6IJjyw', 'profile_url': 'https://www.yelp.com/user_details?userid=9jDC8hjrEqYGm4Ju6IJjyw', 'image_url': 'https://s3-media4.fl.yelpcdn.com/photo/tx1EcY6XVx9VIqAsEEXQCg/o.jpg', 'name': 'Liz R.'}",DRzHjQ_HnY2quHf7vcCp5A
zzax_ouRsgPWyZt-yxFZ6g,https://www.yelp.com/biz/madero-rio-de-janeiro?adjust_creative=ZaFQ4_OiriT3AVd55N_QPg&hrid=zzax_ouRsgPWyZt-yxFZ6g&utm_campaign=yelp_api_v3&utm_medium=api_v3_business_reviews&utm_source=ZaFQ4_OiriT3AVd55N_QPg,"I would have liked to rate them as a 3.5. Decent burger and reasonable prices, especially at happy hour (Monday to Friday from 5 to 8pm). My burger was a...",4,2022-01-17 15:59:31,"{'id': 'RD365MaKbCCjpZQ2KkxROg', 'profile_url': 'https://www.yelp.com/user_details?userid=RD365MaKbCCjpZQ2KkxROg', 'image_url': 'https://s3-media1.fl.yelpcdn.com/photo/hOEP0hehyc9IKkrjZGt9ew/o.jpg', 'name': 'Alex H.'}",DRzHjQ_HnY2quHf7vcCp5A
